### ISSUE TITLE
Fluentd is not sending JTI packets to InfluxDB

### ISSUE THREAD

**Issue by dmontagner** [Juniper/open-nti#31]
Hello team,

I have configured open-NTI without using Docker and I am experiencing the following issue with the JTI packets.

The JTI packets are arriving at my server but fluentd is not sending them to the InfluxDB.

I have to note that I did change the default port for JTI to 2000.

I have uncommented lines 100-103 of the fluent.conf and restarted it. But I still cannot see any additional information being printed in the /var/log/fluentd.log.

**Information from /var/log/fluentd.log**

```
root@automation-srv:~# tail /var/log/fluentd.log
  </match>
</ROOT>
2016-03-30 05:51:39 +1100 [info]: plugin/in_forward.rb:81:listen: listening fluent socket on 0.0.0.0:24224
2016-03-30 05:51:39 +1100 [info]: plugin/in_udp.rb:27:listen: listening udp socket on 0.0.0.0:2000
2016-03-30 05:51:39 +1100 [info]: plugin/in_udp.rb:27:listen: listening udp socket on 0.0.0.0:50010
2016-03-30 05:51:39 +1100 [info]: plugin/in_udp.rb:27:listen: listening udp socket on 0.0.0.0:50020
2016-03-30 05:51:39 +1100 [info]: plugin/in_udp.rb:27:listen: listening udp socket on 0.0.0.0:50021
2016-03-30 05:51:39 +1100 [info]: plugin/in_syslog.rb:176:listen: listening syslog socket on 0.0.0.0:6000 with udp
2016-03-30 05:51:39 +1100 [debug]: plugin/in_monitor_agent.rb:235:start: listening monitoring http server on http://0.0.0.0:24220/api/plugins
2016-03-30 05:51:39 +1100 [info]: plugin/in_debug_agent.rb:49:start: listening dRuby uri="druby://127.0.0.1:24230" object="Engine"
root@automation-srv:~#
```

**startup file for fluentd**

root@automation-srv:~# cat /etc/service/fluentd/run
```
#!/bin/sh
# `/sbin/setuser memcache` runs the given command as the user `memcache`.
# If you omit that part, the command will be run as root.
# fluentd -c /fluent/fluent.conf -vv
fluentd -c /fluent/fluent.conf -vv >>/var/log/fluentd.log 2>&1
root@automation-srv:~#
```

**processes related to fluentd**

root@automation-srv:~# ps ax | grep fluent
25546 pts/4    S      0:00 /bin/sh /etc/service/fluentd/run
25547 pts/4    Sl     0:00 /usr/bin/ruby2.2 /usr/local/bin/fluentd -c /fluent/fluent.conf -vv
25549 pts/4    Sl     0:00 /usr/bin/ruby2.2 /usr/local/bin/fluentd -c /fluent/fluent.conf -vv
25727 pts/4    S+     0:00 grep fluent
root@automation-srv:~#

**services port name register**

```
root@automation-srv:~# cat /etc/services | grep j-vision
j-vision  	2000/tcp			# j-Vision
j-vision  	2000/udp
```

**netstat** 

```
root@automation-srv:~# netstat -a | grep j-vision
udp        0      0 0.0.0.0:j-vision        0.0.0.0:*
```

**lsof**

```
root@automation-srv:~# lsof -i | grep j-vision
fluentd   25549        root   12u  IPv4 3503058      0t0  UDP *:j-vision
```

**tcpdump on eth2 (where the JTI packets are arriving)**

```
root@automation-srv:~# tcpdump -n -i eth2 port 2000 -s 1500 -xx -XX
tcpdump: verbose output suppressed, use -v or -vv for full protocol decode
listening on eth2, link-type EN10MB (Ethernet), capture size 1500 bytes
06:07:37.956842 IP 10.254.254.100.1000 > 10.1.1.100.2000: UDP, length 104
	0x0000:  0050 5685 3ce3 0050 5685 6656 0800 45c0  .PV.<..PV.fV..E.
	0x0010:  0084 0504 0000 fe11 a1dd 0afe fe64 0a01  .............d..
	0x0020:  0164 03e8 07d0 0070 0000 0a0e 3130 2e32  .d.....p....10.2
	0x0030:  3534 2e32 3534 2e31 3030 1000 2219 726f  54.254.100..".ro
	0x0040:  7574 696e 672d 656e 6769 6e65 2d63 7075  uting-engine-cpu
	0x0050:  2d6d 656d 6f72 7928 e38b 0b30 f6a4 ebb7  -memory(...0....
	0x0060:  05aa 062e e2a4 012a 0a28 0a15 0a06 4b65  .......*.(....Ke
	0x0070:  726e 656c 1080 8080 8008 18d8 e094 4720  rnel..........G.
	0x0080:  060a 0f0a 0344 4d41 1080 8080 8002 1800  .....DMA........
	0x0090:  2000                                     ..
06:07:37.970028 IP 10.254.254.100.1000 > 10.1.1.100.2000: UDP, length 116
	0x0000:  0050 5685 3ce3 0050 5685 6656 0800 45c0  .PV.<..PV.fV..E.
	0x0010:  0090 0584 0000 fe11 a151 0afe fe64 0a01  .........Q...d..
	0x0020:  0164 03e8 07d0 007c 0000 0a0e 3130 2e32  .d.....|....10.2
	0x0030:  3534 2e32 3534 2e31 3030 1000 2217 6c6f  54.254.100..".lo
	0x0040:  6769 6361 6c2d 696e 7465 7266 6163 652d  gical-interface-
	0x0050:  7374 6174 7328 e38b 0b30 f6a4 ebb7 05aa  stats(...0......
	0x0060:  063c e2a4 0138 3a36 0a34 0a0a 6765 2d30  .<...8:6.4..ge-0
	0x0070:  2f30 2f30 2e30 1085 91fb b505 188f 042a  /0/0.0.........*
	0x0080:  0c08 b493 3b10 fea0 c421 20ce 0332 0908  ....;....!...2..
	0x0090:  edfe 1210 81bd b814 3a04 0a02 7570       ........:...up
06:07:58.383167 IP 10.254.254.100.1000 > 10.1.1.100.2000: UDP, length 104
	0x0000:  0050 5685 3ce3 0050 5685 6656 0800 45c0  .PV.<..PV.fV..E.
	0x0010:  0084 0505 0000 fe11 a1dc 0afe fe64 0a01  .............d..
	0x0020:  0164 03e8 07d0 0070 0000 0a0e 3130 2e32  .d.....p....10.2
	0x0030:  3534 2e32 3534 2e31 3030 1000 2219 726f  54.254.100..".ro
	0x0040:  7574 696e 672d 656e 6769 6e65 2d63 7075  uting-engine-cpu
	0x0050:  2d6d 656d 6f72 7928 e48b 0b30 8ba5 ebb7  -memory(...0....
	0x0060:  05aa 062e e2a4 012a 0a28 0a15 0a06 4b65  .......*.(....Ke
	0x0070:  726e 656c 1080 8080 8008 18d8 e094 4720  rnel..........G.
	0x0080:  060a 0f0a 0344 4d41 1080 8080 8002 1800  .....DMA........
	0x0090:  2000                                     ..
06:07:58.393869 IP 10.254.254.100.1000 > 10.1.1.100.2000: UDP, length 116
	0x0000:  0050 5685 3ce3 0050 5685 6656 0800 45c0  .PV.<..PV.fV..E.
	0x0010:  0090 0585 0000 fe11 a150 0afe fe64 0a01  .........P...d..
	0x0020:  0164 03e8 07d0 007c 0000 0a0e 3130 2e32  .d.....|....10.2
	0x0030:  3534 2e32 3534 2e31 3030 1000 2217 6c6f  54.254.100..".lo
	0x0040:  6769 6361 6c2d 696e 7465 7266 6163 652d  gical-interface-
	0x0050:  7374 6174 7328 e48b 0b30 8ba5 ebb7 05aa  stats(...0......
	0x0060:  063c e2a4 0138 3a36 0a34 0a0a 6765 2d30  .<...8:6.4..ge-0
	0x0070:  2f30 2f30 2e30 1085 91fb b505 188f 042a  /0/0.0.........*
	0x0080:  0c08 b493 3b10 fea0 c421 20ce 0332 0908  ....;....!...2..
	0x0090:  effe 1210 95bf b814 3a04 0a02 7570       ........:...up
^C
4 packets captured
4 packets received by filter
0 packets dropped by kernel
root@automation-srv:~#
```

**on InfluxDB, the table measurements do exist the result of query ---| SELECT * FROM "\<measurements\>" |----- are empty**

**checking the fluentd documentation, I have changed the stdout/stderr redirection to the -o directive**

```
root@automation-srv:~# ps ax | grep fluent
25949 pts/4    S      0:00 /bin/sh /etc/service/fluentd/run
25950 pts/4    Sl     0:00 /usr/bin/ruby2.2 /usr/local/bin/fluentd -c /fluent/fluent.conf -vv -o /var/log/fluentd.log
25952 pts/4    Sl     0:00 /usr/bin/ruby2.2 /usr/local/bin/fluentd -c /fluent/fluent.conf -vv -o /var/log/fluentd.log
25969 pts/4    S+     0:00 grep fluent
root@automation-srv:~#
```

**but I still don't see any additional output in the fluentd logs**

```
root@automation-srv:~# tail /var/log/fluentd.log
  </match>
</ROOT>
2016-03-30 06:12:36 +1100 [info]: plugin/in_forward.rb:81:listen: listening fluent socket on 0.0.0.0:24224
2016-03-30 06:12:36 +1100 [info]: plugin/in_udp.rb:27:listen: listening udp socket on 0.0.0.0:2000
2016-03-30 06:12:36 +1100 [info]: plugin/in_udp.rb:27:listen: listening udp socket on 0.0.0.0:50010
2016-03-30 06:12:36 +1100 [info]: plugin/in_udp.rb:27:listen: listening udp socket on 0.0.0.0:50020
2016-03-30 06:12:36 +1100 [info]: plugin/in_udp.rb:27:listen: listening udp socket on 0.0.0.0:50021
2016-03-30 06:12:36 +1100 [info]: plugin/in_syslog.rb:176:listen: listening syslog socket on 0.0.0.0:6000 with udp
2016-03-30 06:12:36 +1100 [debug]: plugin/in_monitor_agent.rb:235:start: listening monitoring http server on http://0.0.0.0:24220/api/plugins
2016-03-30 06:12:36 +1100 [info]: plugin/in_debug_agent.rb:49:start: listening dRuby uri="druby://127.0.0.1:24230" object="Engine"
root@automation-srv:~#
```

**looking at the InfluxDB logs, I can't see any INSERT query**

**if required, I can provide remote access to my server for further troubleshooting**

[fluent.conf.txt](https://github.com/Juniper/open-nti/files/194159/fluent.conf.txt)
[fluentd.log.txt](https://github.com/Juniper/open-nti/files/194160/fluentd.log.txt)
[influxdb.log.zip](https://github.com/Juniper/open-nti/files/194176/influxdb.log.zip)

<<<<<< I have attached the fluent.conf, fluentd.log and influxdb.log of my setup.

**Comment by dmontagner** [comment]
This problem is now solved. I had three problems.

**Problem 1**

I had a wrong JTI config on my VMX. Here are the changes that fixed the problem:

```
dmontagner@vmx> show configuration | compare rollback 1
[edit services analytics sensor logical-interface-stats]
-    resource /junos/system/linecard/interface/logical/usage/;
+    resource /junos/system/linecard/interface/;
[edit services analytics]
!     inactive: sensor routing-engine-cpu-memory { ... }

dmontagner@vmx>
```

**Problem 2**

I was missing the JSON configuration files for the dashboards in the /src/dashboard directory. Once I put them there, I started to see the dashboards on grafana.

**Problem 3**

Although the dashboard was showing up in grafana, it was presenting fake data. This usually happens when there is no datasource configured. Again, I was missing one thing. I had to execute the following script:

```
/etc/my_init.d/grafana.init.sh
```


This script configured the datasource in grafana and now I am able to see the JTI data in the dashboard.
